### ISSUE TITLE
Drop connection to private IP after upgrading from 2.8.11 to 2.9.1

### ISSUE THREAD

**Issue by Trogvars** [MHSanaei/3x-ui#4068]
Had private IP connection routing settled so users can reach private server via Xray+Vless.
After upgrade users can't connect to this IP - conection is dropping.
Client can't do TLS handshake.

Was:

```
~ $ curl -k -v https://192.168.10.2
*   Trying 192.168.10.2:443...
* ALPN: curl offers h2,http/1.1
* TLSv1.3 (OUT), TLS handshake, Client hello (1):
* SSL Trust: peer verification disabled
* TLSv1.3 (IN), TLS handshake, Server hello (2):
* TLSv1.3 (IN), TLS change cipher, Change cipher spec (1):
* TLSv1.3 (IN), TLS handshake, Encrypted Extensions (8):
* TLSv1.3 (IN), TLS handshake, Certificate (11):
* TLSv1.3 (IN), TLS handshake, CERT verify (15):
* TLSv1.3 (IN), TLS handshake, Finished (20):
* TLSv1.3 (OUT), TLS change cipher, Change cipher spec (1):
* TLSv1.3 (OUT), TLS handshake, Finished (20):
* SSL connection using TLSv1.3 / TLS_CHACHA20_POLY1305_SHA256 / x25519 / id-ecPublicKey
* ALPN: server accepted h2
* Server certificate:
*   subject: CN=*.mysite.com
*   start date: Feb  5 02:20:49 2026 GMT
*   expire date: May  6 02:20:48 2026 GMT
*   issuer: C=US; O=Let's Encrypt; CN=E8
*   Certificate level 0: Public key type EC/prime256v1 (256/128 Bits/secBits), signed using ecdsa-with-SHA384
*   Certificate level 1: Public key type EC/secp384r1 (384/192 Bits/secBits), signed using sha256WithRSAEncryption
*  SSL certificate verification failed, continuing anyway!
* Established connection to 192.168.10.2 (192.168.10.2 port 443) from 10.10.14.1 port 42266
* using HTTP/2
* [HTTP/2] [1] OPENED stream for https://192.168.10.2/
* [HTTP/2] [1] [:method: GET]
* [HTTP/2] [1] [:scheme: https]
* [HTTP/2] [1] [:authority: 192.168.10.2]
* [HTTP/2] [1] [:path: /]
* [HTTP/2] [1] [user-agent: curl/8.18.0]
* [HTTP/2] [1] [accept: */*]
> GET / HTTP/2
> Host: 192.168.10.2
> User-Agent: curl/8.18.0
> Accept: */*
>
* Request completely sent off
* TLSv1.3 (IN), TLS handshake, Newsession Ticket (4):
< HTTP/2 404
< content-type: text/html; charset=us-ascii
< server: Microsoft-HTTPAPI/2.0
< date: Tue, 21 Apr 2026 17:02:10 GMT
< content-length: 315
<
<!DOCTYPE HTML PUBLIC "-//W3C//DTD HTML 4.01//EN""http://www.w3.org/TR/html4/strict.dtd">
<HTML><HEAD><TITLE>Not Found</TITLE>
<META HTTP-EQUIV="Content-Type" Content="text/html; charset=us-ascii"></HEAD>
<BODY><h2>Not Found</h2>
<hr><p>HTTP Error 404. The requested resource is not found.</p>
</BODY></HTML>
* Connection #0 to host 192.168.10.2:443 left intact
```

Now:
```
~ $ curl -k -v https://192.168.10.2
*   Trying 192.168.10.2:443...
* ALPN: curl offers h2,http/1.1
* TLSv1.3 (OUT), TLS handshake, Client hello (1):
* SSL Trust: peer verification disabled
* TLSv1.3 (OUT), TLS alert, decode error (562):
* TLS connect error: error:0A000126:SSL routines::unexpected eof while reading
* closing connection #0
curl: (35) TLS connect error: error:0A000126:SSL routines::unexpected eof while reading

```
type=tcp
encryption=none
security=reality
fp=chrome
flow=xtls-rprx-vision

Sniffing is off.
Nothing changes in configs.
Private IPs is direct in routing,

From VPS with 3x-ui 192.168.10.2 is reachable, all connections are fine.

**Comment by n-sisyukin** [comment]
I noticed this problem when switching from Xray 26.3.x to 26.4.x, even within 3x-ui 2.8.11

**Comment by mikpi** [comment]
Seems like this is new default behavior for vless and some other inbounds - to block private IPs on freedom outbound.
You can change it by setting "ipsBlocked": [] in outbound settings:
```
{
  "outbounds": [
    {
      "protocol": "freedom",
      "settings": {
        "domainStrategy": "UseIP",
        "ipsBlocked": []
      },
      "tag": "direct"
    }
  ]
}
```

More details in docs: https://xtls.github.io/en/config/outbounds/freedom.html (see ipsBlocked setting section)

**Comment by Trogvars** [comment]
> Seems like this is new default behavior for vless and some other inbounds - to block private IPs on freedom outbound. You can change it by setting "ipsBlocked": [] in outbound settings:
> 
> ```
> {
>   "outbounds": [
>     {
>       "protocol": "freedom",
>       "settings": {
>         "domainStrategy": "UseIP",
>         "ipsBlocked": []
>       },
>       "tag": "direct"
>     }
>   ]
> }
> ```
> 
> More details in docs: https://xtls.github.io/en/config/outbounds/freedom.html (see ipsBlocked setting section)

Nope.
I have this rule in outbounds already:
```
{
  "protocol": "freedom",
  "settings": {
    "domainStrategy": "AsIs"
  },
  "tag": "direct"
}
```

Tried to change stratgy to UseIP - nothing changed.

I used 26.2.6 Xray version with 2.8.11, now to 26.4.17 with 2.9.1.

**Comment by SonivelY** [comment]
I had the same issue, performing an x-ui upgrade from version 2.8.11 to version 2.9.1 and the server disconnected

**Comment by Trogvars** [comment]
Srtarted tcpdump at destination host with private IP and there is traffic from client but it suddenly interrupted.
So it's not blocked.

```
13:50:19.659621 IP 192.168.10.3.27868 > 192.168.10.2.443: Flags [S], seq 3158673531, win 42340, options [mss 1460,sackOK,TS val 2314852553 ecr 0,nop,wscale 11], length 0
13:50:19.659964 IP 192.168.10.2.443 > 192.168.10.3.27868: Flags [S.], seq 1060917680, ack 3158673532, win 65535, options [mss 1460,nop,wscale 8,sackOK,TS val 479819977 ecr 2314852553], length 0
13:50:19.659977 IP 192.168.10.3.27868 > 192.168.10.2.443: Flags [.], ack 1, win 21, options [nop,nop,TS val 2314852553 ecr 479819977], length 0
13:50:19.660017 IP 192.168.10.3.27868 > 192.168.10.2.443: Flags [F.], seq 1, ack 1, win 21, options [nop,nop,TS val 2314852553 ecr 479819977], length 0
13:50:19.660314 IP 192.168.10.2.443 > 192.168.10.3.27868: Flags [R.], seq 1, ack 2, win 0, length 0
```

**Comment by mikpi** [comment]
> Nope. I have this rule in outbounds already:
> 
> ```
> {
>   "protocol": "freedom",
>   "settings": {
>     "domainStrategy": "AsIs"
>   },
>   "tag": "direct"
> }
> ```
> 
> Tried to change stratgy to UseIP - nothing changed.
> 
> I used 26.2.6 Xray version with 2.8.11, now to 26.4.17 with 2.9.1.

You don't have empty ipsBlocked list in outbound settings. By default it contains private IPs.
Add `"ipsBlocked": []` to settings

**Comment by Trogvars** [comment]
Doesn't wotk at all. Can't complete connection test.

```
{
  "protocol": "freedom",
  "settings": {
    "domainStrategy": "AsIs",
    "ipsBlocked": [
      "[]"
    ]
  },
  "tag": "direct"
}
```

**Comment by Trogvars** [comment]
When I enter  "ipsBlocked": []" and press save it goes away from config and it become like i showed before:
```
{
  "protocol": "freedom",
  "settings": {
    "domainStrategy": "AsIs"
  },
  "tag": "direct"
}
```

**Comment by mikpi** [comment]
> Doesn't wotk at all. Can't complete connection test.
> 
> ```
> {
>   "protocol": "freedom",
>   "settings": {
>     "domainStrategy": "AsIs",
>     "ipsBlocked": [
>       "[]"
>     ]
>   },
>   "tag": "direct"
> }
> ```

Because you made a mistake. Take a better look at original comment.

**Comment by Trogvars** [comment]
> When I enter "ipsBlocked": []" and press save it goes away from config and it become like i showed before:



> When I enter "ipsBlocked": []" and press save it goes away from config and it become like i showed before:
> 
> ```
> {
>   "protocol": "freedom",
>   "settings": {
>     "domainStrategy": "AsIs"
>   },
>   "tag": "direct"
> }
> ```

Also tried it.

**Comment by Trogvars** [comment]
<img width="579" height="538" alt="Image" src="https://github.com/user-attachments/assets/971e3744-eda6-4a57-a065-cf090c1db303" />

<img width="621" height="375" alt="Image" src="https://github.com/user-attachments/assets/1dca94d3-710f-47e4-a6c5-02031da5a9a6" />

**Comment by mikpi** [comment]
```
{
  "protocol": "freedom",
  "settings": {
    "domainStrategy": "AsIs",
    "ipsBlocked": []
  },
  "tag": "direct"
}
```

**Comment by Trogvars** [comment]
> ```
> {
>   "protocol": "freedom",
>   "settings": {
>     "domainStrategy": "AsIs",
>     "ipsBlocked": []
>   },
>   "tag": "direct"
> }
> ```

It doesn't save this config like you show. The panel remove empty ipsBlocked rule cause it's empty!

**Comment by Trogvars** [comment]
And if you see some comments up you will see that private ips is working - traffic goes to the host, but it's interrupted on handshake.
Check my  tcpdump log on destination machine.

**Comment by mikpi** [comment]
> It doesn't save this config like you show. The panel remove empty ipsBlocked rule cause it's empty!

This should be done within Xray configs advanced tab

<img width="281" height="91" alt="Image" src="https://github.com/user-attachments/assets/e23ff17a-de09-4e43-9fda-d0d912a4feb1" />

Find outbound with tag "direct" and add "ipsBlocked": [] to it.

<img width="305" height="226" alt="Image" src="https://github.com/user-attachments/assets/50661e7d-5037-45e5-8fd7-b250d00fa8e5" />

**Comment by Trogvars** [comment]
WTF! It worked! 

<img width="538" height="570" alt="Image" src="https://github.com/user-attachments/assets/bb32a011-de9e-400a-a299-d442ebb44f29" />

**Comment by Trogvars** [comment]
> > It doesn't save this config like you show. The panel remove empty ipsBlocked rule cause it's empty!
> 
> This should be done within Xray configs advanced tab
> 

Thanks you for help!

**Comment by mrekin** [comment]
Just to keep it here
"ipsBlocked": [] works with
v26.5.9 core
but don't with 
v26.5.9
