### ISSUE TITLE
[Bug]: VLESS + Reality TCP handshake drops after xray 26.6.1 update

### ISSUE THREAD

**Issue by sashaAverin** [MHSanaei/3x-ui#4980]
### Describe the bug

After updating to xray 26.6.1, VLESS + Reality stops working. TCP connection establishes, xray connects to dest target (Yahoo), but connection drops after ~12 seconds without completing Reality handshake. Client gets “server closed connection” error.

### How to reproduce the problem

	1.	Configure VLESS + Reality inbound
	2.	Try to connect from client
	3.	Connection drops after ~12 seconds

### Expected behavior

Successful VPN connection

### Actual behavior

TCP handshake drops, no data transferred

### Relevant logs

```shell
13:15:11.401038 net0  In  IP 94.181.225.18.64460 > 213.165.46.141.443: Flags [SEW]
13:15:11.401098 net0  Out IP 213.165.46.141.443 > 94.181.225.18.64460: Flags [S.E]
13:15:11.440273 net0  Out IP 213.165.46.141.56210 > 74.6.231.20.443: Flags [S]
13:15:11.602137 net0  In  IP 74.6.231.20.443 > 213.165.46.141.56210: Flags [S.]
13:15:23.542000 net0  In  IP 74.6.231.20.443 > 213.165.46.141.56210: Flags [F.]
13:15:23.542233 net0  Out IP 213.165.46.141.443 > 94.181.225.18.64460: Flags [F.] 

```

### 3x-ui version

3.2.8

### Xray-core version

26.6.1

### How did you install 3x-ui?

install.sh script

### Operating system

Ubuntu 24

### Is the panel behind a reverse proxy or CDN?

None

### Before submitting

- [x] I searched [existing issues](../issues?q=is%3Aissue) and this bug has not been reported.
- [x] I am running the latest released version of 3x-ui (or have verified the bug still exists on it).
- [x] This bug report is written in English.
- [x] I have redacted any sensitive data (tokens, real domains, client UUIDs).

**Comment by sashaAverin** [comment]
Thanks for the analysis!

Confirming: I’m located in Russia. After downgrading to v3.2.6 I will test and report back.

Also regarding the DPI comment — I tested on both Dom.ru and Megafon networks, same result on both. Will try the Cloudflare/TLS approach if downgrade doesn’t help.

**Comment by madcat-314** [comment]
Hi! If the value in Inbound - Security - Reality - uTLS is set to Chrome, try changing it to Firefox.

**Comment by sashaAverin** [comment]
Downgrading to v3.2.6 (xray 26.3.27) did not resolve the issue — the same TCP handshake drop behavior persisted.

The working solution was switching from VLESS+Reality to VLESS+WebSocket+TLS proxied through Cloudflare CDN. This completely bypasses the DPI detection issue on Russian ISPs (tested on Domru and Megafon networks).

So the root cause appears to be ISP-level DPI blocking Reality traffic in Russia, not necessarily a regression in xray 26.6.1 — though the timing of the update coinciding with users losing connectivity is still suspicious.

**Comment by wavewithme** [comment]
Have similar issue, change uTLS Chrome -> Firefox works for me.

**Comment by glbart** [comment]
> Have similar issue, change uTLS Chrome -> Firefox works for me.

+1, same issue. Chrome → Firefox fixed it.
